{
  "id": "run-0009",
  "batch_id": "batch-002",
  "candidate_issue_id": "go-task-task-2505",
  "issue_url": "https://github.com/go-task/task/issues/2505",
  "task_type": "bugfix",
  "repository": "go-task/task",
  "agent": "github-copilot-via-opencode",
  "executor_tool": "opencode",
  "provider": "github-copilot",
  "model": "gpt-5-mini",
  "model_identifier": "github-copilot/gpt-5-mini",
  "model_substitution_reason": null,
  "status": "not_executed",
  "timestamp": "2026-05-08T00:00:00.000Z",
  "executor_prompt": "run-0009/executor-prompt.md",
  "executor_command": "opencode run \"$(cat evals/runs/run-0009/executor-prompt.md)\"",
  "expected_evidence_paths": [
    "agent-task-summary.md",
    "issue-metadata.json",
    "repo-metadata.json",
    "commands-run.md",
    "reproduction-output.txt",
    "validation-output.txt",
    "changes.patch",
    "no-changes.md",
    "reproduction-notes.md",
    "failure-log.md",
    "incomplete-reason.md",
    "metadata.json"
  ],
  "notes": "Prepared for Batch 002 preflight only. This run has not been executed.",
  "base_commit": "5f78da2d0af3bcdf3ac0bb253eca6900ef84706f",
  "base_ref": "default-branch-depth-1",
  "environment_preflight": {
    "checked_at": "2026-05-08T00:00:00.000Z",
    "issue_state": "open",
    "clone_status": "passed",
    "clone_command": "git clone --depth 1 https://github.com/go-task/task evals/workspaces/run-0009/task",
    "install_status": "blocked",
    "install_command": "go mod download",
    "baseline_status": "blocked",
    "baseline_commands": [
      "go test ./..."
    ],
    "reproduction_status": "documented",
    "validation_command": "go test ./...",
    "reproduction_notes": "Open issue as of 2026-05-08 and cloned successfully. Local install/build/test were not verified because Go is not installed on this machine; executor must treat this as a preflight blocker unless Go is available before execution.",
    "external_repo_worktree_clean_after_preflight": true,
    "blockers": [
      "Go tooling is not installed locally, so setup/build/test could not be verified."
    ]
  }
}
